{
  "scenarioSlug": "Service_Request_Agent",
  "title": "Service Request Agent",
  "summary": "An authenticated Copilot Studio agent grounds answers in SharePoint and creates approved service requests through an agent flow.",
  "businessArchitecture": {"headline": "Service Request Agent / business operating model", "statement": "Grounded answers first. Governed actions only with accountable approval.", "cards": [{"id": "BIZ-ENTRY", "role": "entry", "code": "PEOPLE & CHANNELS", "title": "Who starts the work", "tone": "slate", "lines": ["Employee", "Microsoft Teams"], "componentIds": ["employee", "teams"], "capabilityIds": []}, {"id": "BIZ-WORK", "role": "capability", "code": "SOLUTION CAPABILITIES", "title": "What the solution does", "tone": "blue", "lines": ["Service Request Agent", "Service request flow"], "componentIds": ["agent", "flow"], "capabilityIds": []}, {"id": "BIZ-DECISION", "role": "decision", "code": "HUMAN DECISION", "title": "Approve before acting", "tone": "amber", "lines": ["Service Approver"], "componentIds": ["approver"], "capabilityIds": []}, {"id": "BIZ-OUTCOME", "role": "outcome", "code": "BUSINESS OUTCOME", "title": "What the business gets", "tone": "green", "lines": ["An authenticated Copilot Studio agent grounds answers in SharePoint and creates approved service requests through an agent flow.", "Native build 100% / PoC demonstration 100%"], "componentIds": [], "capabilityIds": []}, {"id": "BIZ-KNOWLEDGE", "role": "foundation", "code": "KNOWLEDGE & SYSTEMS", "title": "Information and systems it uses", "tone": "violet", "lines": ["SharePoint knowledge", "Microsoft Dataverse"], "componentIds": ["knowledge", "dataverse"], "capabilityIds": []}, {"id": "BIZ-PLATFORM", "role": "foundation", "code": "PLATFORM", "title": "Where it runs", "tone": "blue", "lines": ["Service Request Agent"], "componentIds": ["agent"], "capabilityIds": []}, {"id": "BIZ-CONTROLS", "role": "control", "code": "EVERY STAGE", "title": "Identity, protection, governance and operations", "tone": "slate", "lines": ["Microsoft Entra ID"], "componentIds": ["entra"], "capabilityIds": []}], "flows": [{"from": "BIZ-ENTRY", "to": "BIZ-CAPABILITIES", "label": "Request or trigger", "tone": "blue"}, {"from": "BIZ-CAPABILITIES", "to": "BIZ-DECISION", "label": "Proposed action", "tone": "amber", "dashed": true}, {"from": "BIZ-DECISION", "to": "BIZ-OUTCOME", "label": "Approved outcome", "tone": "green"}, {"from": "BIZ-KNOWLEDGE", "to": "BIZ-CAPABILITIES", "label": "Information and actions", "tone": "teal"}, {"from": "BIZ-PLATFORM", "to": "BIZ-CAPABILITIES", "label": "Runs the work", "tone": "blue"}]},
  "complexity": "Medium",
  "coverage": {"nativeBuildPercent": 100, "pocDemonstrationPercent": 100, "unsupportedPercent": 0, "unknownPercent": 0},
  "referenceKeys": [
    "architecture-diagrams",
    "copilot-studio-overview",
    "copilot-studio-harnesses",
    "copilot-studio-orchestration",
    "copilot-studio-knowledge",
    "copilot-studio-tools",
    "copilot-studio-agent-flows",
    "copilot-studio-authentication",
    "power-platform-data-policies",
    "power-platform-alm"
  ],
  "components": [
    {"id": "employee", "name": "Employee", "layer": "users", "kind": "actor", "status": "existing", "implementationStatus": "existing", "buildOwner": "customer", "pocScope": "included", "productionStatus": "ready", "iconKey": "users", "description": "Authenticated requester"},
    {"id": "teams", "name": "Microsoft Teams", "layer": "channels", "kind": "channel", "status": "existing", "implementationStatus": "existing", "buildOwner": "customer", "pocScope": "included", "productionStatus": "ready", "iconKey": "microsoft-teams", "description": "Conversation channel"},
    {"id": "entra", "name": "Microsoft Entra ID", "layer": "governance", "kind": "security", "status": "existing", "implementationStatus": "existing", "buildOwner": "customer", "pocScope": "included", "productionStatus": "ready", "iconKey": "entra-id", "description": "User authentication"},
    {"id": "agent", "name": "Service Request Agent", "layer": "agent-platform", "kind": "agent", "status": "to-create", "implementationStatus": "configure", "buildOwner": "agent-builder", "pocScope": "included", "productionStatus": "requires-hardening", "iconKey": "copilot-studio", "description": "Instructions and generative orchestration"},
    {"id": "knowledge", "name": "SharePoint knowledge", "layer": "agent-platform", "kind": "knowledge", "status": "existing", "implementationStatus": "existing", "buildOwner": "customer", "pocScope": "included", "productionStatus": "ready", "iconKey": "microsoft-sharepoint", "description": "Grounded policy content"},
    {"id": "flow", "name": "Service request flow", "layer": "data-integration", "kind": "flow", "status": "to-create", "implementationStatus": "build", "buildOwner": "agent-builder", "pocScope": "included", "productionStatus": "requires-hardening", "iconKey": "power-automate", "description": "Creates approved requests"},
    {"id": "dataverse", "name": "Microsoft Dataverse", "layer": "data-integration", "kind": "data", "status": "existing", "implementationStatus": "existing", "buildOwner": "customer", "pocScope": "included", "productionStatus": "ready", "iconKey": "dataverse", "description": "Service request records"},
    {"id": "approver", "name": "Service Approver", "layer": "agent-platform", "kind": "human", "status": "existing", "implementationStatus": "existing", "buildOwner": "customer", "pocScope": "included", "productionStatus": "ready", "iconKey": "users", "description": "Binding approval decision"}
  ],
  "relationships": [
    {"from": "employee", "to": "entra", "label": "Authenticate user", "style": "call", "implementationMode": "real"},
    {"from": "employee", "to": "teams", "label": "Conversation", "style": "call", "implementationMode": "real"},
    {"from": "teams", "to": "agent", "label": "Authenticated request", "style": "call", "implementationMode": "real"},
    {"from": "agent", "to": "teams", "label": "Return response", "style": "response", "implementationMode": "real"},
    {"from": "teams", "to": "employee", "label": "Present response", "style": "response", "implementationMode": "real"},
    {"from": "agent", "to": "knowledge", "label": "Grounded retrieval", "style": "call", "implementationMode": "real"},
    {"from": "agent", "to": "approver", "label": "Approval request", "style": "optional", "implementationMode": "real"},
    {"from": "agent", "to": "flow", "label": "Approved action", "style": "call", "implementationMode": "real"},
    {"from": "flow", "to": "dataverse", "label": "Create record", "style": "call", "implementationMode": "real"}
  ],
  "sequence": [
    {"from": "employee", "to": "entra", "label": "Sign in", "type": "call", "implementationMode": "real", "capabilityId": null, "fragment": null, "phase": "Authentication"},
    {"from": "entra", "to": "employee", "label": "Issue authenticated session", "type": "response", "implementationMode": "real", "capabilityId": null, "fragment": null, "phase": "Authentication"},
    {"from": "employee", "to": "teams", "label": "Submit service request", "type": "call", "implementationMode": "real", "capabilityId": null, "fragment": null, "phase": "Request intake"},
    {"from": "teams", "to": "agent", "label": "Route authenticated request", "type": "call", "implementationMode": "real", "capabilityId": null, "fragment": null, "phase": "Request intake"},
    {"from": "agent", "to": "agent", "label": "Select knowledge and tools", "type": "self", "implementationMode": "real", "capabilityId": null, "fragment": null, "phase": "Policy grounding"},
    {"from": "agent", "to": "knowledge", "label": "Retrieve applicable policy", "type": "call", "implementationMode": "real", "capabilityId": null, "fragment": null, "phase": "Policy grounding"},
    {"from": "knowledge", "to": "agent", "label": "Return grounded content", "type": "response", "implementationMode": "real", "capabilityId": null, "fragment": null, "phase": "Policy grounding"},
    {"from": "agent", "to": "approver", "label": "Request approval", "type": "approval", "implementationMode": "real", "capabilityId": null, "fragment": "alt [approval required]", "phase": "Human decision"},
    {"from": "approver", "to": "agent", "label": "Approve request", "type": "response", "implementationMode": "real", "capabilityId": null, "fragment": "alt [approval required]", "phase": "Human decision"},
    {"from": "agent", "to": "flow", "label": "Create approved request", "type": "call", "implementationMode": "real", "capabilityId": null, "fragment": null, "phase": "Approved execution"},
    {"from": "flow", "to": "dataverse", "label": "Write request record", "type": "call", "implementationMode": "real", "capabilityId": null, "fragment": null, "phase": "Approved execution"},
    {"from": "dataverse", "to": "flow", "label": "Return request ID", "type": "response", "implementationMode": "real", "capabilityId": null, "fragment": null, "phase": "Approved execution"},
    {"from": "agent", "to": "teams", "label": "Confirm request and ID", "type": "response", "implementationMode": "real", "capabilityId": null, "fragment": null, "phase": "Response"},
    {"from": "teams", "to": "employee", "label": "Present confirmation", "type": "response", "implementationMode": "real", "capabilityId": null, "fragment": null, "phase": "Response"}
  ]
}
